<?xml version="1.0" encoding="UTF-8"?>
<!DOCTYPE resources SYSTEM "resources.dtd" [
    <!ENTITY contentProperty "Dokumenteigenschaften">
    <!ENTITY contentProperties "Dokumenteneigenschaften"> 
    <!ENTITY document "Dokument">
    <!ENTITY documents "Dokumente"> 
    <!ENTITY version "Version">
    <!ENTITY versions "Versionen"> 
    <!ENTITY versionHistory "Versionshistorie">
    <!ENTITY versionHistories "Historie der Versionen"> 
    ]>
    <!-- TODO siehe Task "3685: Internationalisierung der Entitäten"--> 
    <!--
        This is the XML document defined by resource.dtd used by ProWim Maziar 
        Khodaei, Ebcot GmbH, 13.05.2009 Example for accelerator: * "INSERT" =>
        getKeyStroke(KeyEvent.VK_INSERT, 0); * "control DELETE" =>
        getKeyStroke(KeyEvent.VK_DELETE, InputEvent.CTRL_MASK); * "alt shift
        X" => getKeyStroke(KeyEvent.VK_X, InputEvent.ALT_MASK |
        InputEvent.SHIFT_MASK); * "alt shift released X" =>
        getKeyStroke(KeyEvent.VK_X, InputEvent.ALT_MASK |
        InputEvent.SHIFT_MASK, true); * "typed a" => getKeyStroke('a');

        Example grouping: <group id="TEST"> <attribute id="NAME" label="Name"
        tooltip="Name of shirt."/> <enumAttribute id="SIZE" label="Size"
        tooltip="Shirt size."> <enum label="S" value="1"/> <enum label="M"
        value="2"/> <enum label="L" value="3"/> </enumAttribute>
        <enumAttributeWithNull id="COLOR" label="Color" tooltip="Color of
        shirt." nullLabel="Choose color:"> <enum label="Red." value="1"/>
        <enum label="Green." value="2"/> <enum label="Blue." value="3"/>
        </enumAttributeWithNull> <composedText id="ORDER"> You ordered
        <argument index="0" type="number" style="integer"/> shirt<argument
        index="0" type="choice" style="0#s|1#|3#s"/>. </composedText> <text
        id="COPYRIGHT"> God of the greedy. </text> </group>
    -->
<resources>
    <group id="FRAMES">
        <group id="GLOBAL">
           <group id="TEXTS">
           </group>
           <group id="IMAGES">
           </group>
           <group id="ACTIONS">
                <action id="ITEM_ADD" label="Element hinzufügen"  src="img/toolbar/add.png" tooltip="Einen Element zu der Liste hinzufügen."/>
                <action id="ITEM_DELETE" label="Element löschen"  src="img/toolbar/delete.png" tooltip="Ausgewählter Element aus der Liste löschen."/>
           </group>
        </group>
        <group id="DIALOG">
            <group id="ACTIONS">
            </group>
            <group id="IMAGES">
            </group>
            <group id="TEXTS">
            </group>
        </group>
        <group id="HEADER">
            <group id="ACTIONS">
            </group>
            <group id="TEXTS">
            </group>
            <group id="IMAGES">
            </group>
        </group>
        <group id="NAVIGATION">
            <group id="ACTIONS">
            </group>
           <group id="IMAGES">
            </group>
        </group>
        <group id="TOOLBAR">
            <group id="IMAGES">
            </group>
            <group id="ACTIONS">
            </group>
        </group>   
        <group id="PROCESS">
            <group id="ACTIONS">
            </group>
            <group id="TEXTS">
            </group>
            <group id="IMAGES">
            </group>            
        </group>  
        <group id="ACTIVITY">
            <group id="ACTIONS">
            </group>
            <group id="TEXTS">
            </group>
            <group id="IMAGES">
            </group>            
        </group>    
        <group id="TREE">
            <group id="ACTIONS">
            </group>
            <group id="IMAGES">
            </group>   
            <group id="TEXTS">
            </group>
        </group>    
        <group id="KNOWLEDGE">
            <group id="ACTIONS">
            </group>
            <group id="TEXTS">
            </group>
            <group id="IMAGES">
            </group>            
        </group>    
        <group id="TABLE">
            <group id="ACTIONS">
            </group>
        </group>
    </group>

        <!-- TODO siehe Task "3685: Internationalisierung der Entitäten" 
    <group id="VALUE_OBJECTS">
        <text id="UNIQUE_KEY">Index</text>
        <group id="DOCUMENT">
            <text id="VO_NAME_SINGULAR">&document;</text>
            <text id="VO_NAME_PLURAL">&documents;</text>
            <attribute id="NAME" label="Name"/>
            <attribute id="TYPE" label="Typ"/>
            <attribute id="SIZE" label="Dateigröße"/>
            <attribute id="FORMAT" label="Format"/>
            <attribute id="CONTENT" label="Datei"/>
        </group>
    </group>-->
    
</resources>
